<?xml version="1.0" encoding="utf-8"?>
  <!-- $Id: pl.xml 661 2012-08-27 11:26:39Z namiltd $ -->
  <!--
    phpSysInfo language file Language: Polish Created by: Mieczyslaw Nalewaj
  -->
<tns:translationPlugin language="polish" charset="utf-8"
  xmlns:tns="http://phpsysinfo.sourceforge.net/translation-plugin" xmlns:xsi="http://www.w3.org/2001/XMLSchema-instance"
  xsi:schemaLocation="http://phpsysinfo.sourceforge.net/translation-plugin ../../../language/translation-plugin.xsd">
  <expression id="plugin_ipmiinfo_001" name="ipmiinfo_title">
    <exp>IPMI Status</exp>
  </expression>
  <expression id="plugin_ipmiinfo_002" name="ipmiinfo_date">
    <exp>Ostatnie odświeżenie</exp>
  </expression>
  <expression id="plugin_ipmiinfo_003" name="ipmiinfo_temperatures">
    <exp>Temperatury [°C]</exp>
  </expression>
  <expression id="plugin_ipmiinfo_004" name="ipmiinfo_fans">
    <exp>Wentylatory [RPM]</exp>
  </expression>
  <expression id="plugin_ipmiinfo_005" name="ipmiinfo_voltages">
    <exp>Napięcia [V]</exp>
  </expression>
  <expression id="plugin_ipmiinfo_006" name="ipmiinfo_misc">
    <exp>Różne [0/1]</exp>
  </expression>
  <expression id="plugin_ipmiinfo_007" name="ipmiinfo_currents">
    <exp>Prądy [A]</exp>
  </expression>
  <expression id="plugin_ipmiinfo_008" name="ipmiinfo_powers">
    <exp>Moce [W]</exp>
  </expression>
</tns:translationPlugin>
