<?xml version="1.0" encoding="utf-8"?>
  <!-- $Id: ro.xml 661 2014-05-02 11:26:39Z namiltd $ -->
  <!--
    phpSysInfo language file Language: Romană Created by: Iulian Alexe
  -->
<tns:translationPlugin language="romana" charset="utf-8"
  xmlns:tns="http://phpsysinfo.sourceforge.net/translation-plugin" xmlns:xsi="http://www.w3.org/2001/XMLSchema-instance"
  xsi:schemaLocation="http://phpsysinfo.sourceforge.net/translation-plugin ../../../language/translation-plugin.xsd">
  <expression id="plugin_updatenotifier_001" name="updatenotifier_title">
    <exp>Updates Notifier</exp>
  </expression>
  <expression id="plugin_updatenotifier_002" name="updatenotifier_th">
    <exp>Actualizări Disponibile</exp>
  </expression>
  <expression id="plugin_updatenotifier_003" name="updatenotifier_packages">
    <exp>Pachetele pot fi actualizate.</exp>
  </expression>
  <expression id="plugin_updatenotifier_004" name="updatenotifier_security">
    <exp>Sunt actualizări de securitate.</exp>
  </expression>
  <expression id="plugin_updatenotifier_005" name="updatenotifier_no">
    <exp>Nu actualizări disponibile</exp>
  </expression>
</tns:translationPlugin>
