<?xml version="1.0" encoding="utf-8"?>
  <!-- $Id: de.xml 661 2012-08-27 11:26:39Z namiltd $ -->
  <!--
    phpSysInfo language file Language: German Created by: Matthias Freund (MAFLO321)
  -->
<tns:translationPlugin language="german" charset="utf-8"
  xmlns:tns="http://phpsysinfo.sourceforge.net/translation-plugin" xmlns:xsi="http://www.w3.org/2001/XMLSchema-instance"
  xsi:schemaLocation="http://phpsysinfo.sourceforge.net/translation-plugin ../../../language/translation-plugin.xsd">
  <expression id="plugin_bat_001" name="bat_title">
    <exp>Akku-Status</exp>
  </expression>
  <expression id="plugin_bat_002" name="bat_date">
    <exp>Letzte Aktualisierung</exp>
  </expression>
  <expression id="plugin_bat_003" name="bat_design_capacity">
    <exp>Bemeskapazität</exp>
  </expression>
  <expression id="plugin_bat_004" name="bat_remaining_capacity">
    <exp>Übrige Kapazität</exp>
  </expression>
  <expression id="plugin_bat_005" name="bat_design_voltage">
    <exp>Bemessungsspannung</exp>
  </expression>
  <expression id="plugin_bat_006" name="bat_present_voltage">
    <exp>Momentane Spannung</exp>
  </expression>
  <expression id="plugin_bat_007" name="bat_item">
    <exp>Dinge</exp>
  </expression>
  <expression id="plugin_bat_008" name="bat_value">
    <exp>Werte</exp>
  </expression>
  <expression id="plugin_bat_009" name="bat_charging_state">
    <exp>Ladezustand</exp>
  </expression>
  <expression id="plugin_bat_010" name="bat_battery_type">
    <exp>Akku-Typ</exp>
  </expression>
  <expression id="plugin_bat_011" name="bat_battery_temperature">
    <exp>Akku-Temperatur</exp>
  </expression>
  <expression id="plugin_bat_012" name="bat_battery_condition">
    <exp>Akku-Zustand</exp>
  </expression>
  <expression id="plugin_bat_013" name="bat_cycle_count">
    <exp>Cycle Count</exp>
  </expression>
</tns:translationPlugin>
