<?xml version="1.0" encoding="utf-8"?>
  <!--
    phpSysInfo language file Language: Russian Created by: Denis Sevostyanov (den007)
  -->
<tns:translationPlugin language="english" charset="utf-8"
  xmlns:tns="http://phpsysinfo.sourceforge.net/translation-plugin" xmlns:xsi="http://www.w3.org/2001/XMLSchema-instance"
  xsi:schemaLocation="http://phpsysinfo.sourceforge.net/translation-plugin ../../../language/translation-plugin.xsd">
  <expression id="plugin_dmraid_001" name="dmraid_title">
    <exp>RAID Статус</exp>
  </expression>
  <expression id="plugin_dmraid_002" name="dmraid_devices">
    <exp>RAID-Устройств</exp>
  </expression>
  <expression id="plugin_dmraid_003" name="dmraid_infos">
    <exp>Дополнительная Информация</exp>
  </expression>
  <expression id="plugin_dmraid_004" name="dmraid_name">
    <exp>Имя</exp>
  </expression>
  <expression id="plugin_dmraid_005" name="dmraid_status">
    <exp>Статус</exp>
  </expression>
  <expression id="plugin_dmraid_006" name="dmraid_type">
    <exp>RAID-Тип</exp>
  </expression>
  <expression id="plugin_dmraid_007" name="dmraid_size">
    <exp>Размер</exp>
  </expression>
  <expression id="plugin_dmraid_008" name="dmraid_stride">
    <exp>Шаг</exp>
  </expression>
  <expression id="plugin_dmraid_009" name="dmraid_subsets">
    <exp>Подмножество</exp>
  </expression>
  <expression id="plugin_dmraid_010" name="dmraid_devs">
    <exp>Устройство</exp>
  </expression>
  <expression id="plugin_dmraid_011" name="dmraid_spares">
    <exp>Резервировано</exp>
  </expression>
</tns:translationPlugin>
