<?xml version="1.0" encoding="utf-8"?>
  <!-- $Id: ro.xml 661 2014-05-02 11:26:39Z namiltd $ -->
  <!--
    phpSysInfo language file Language: Romană Created by: Iulian Alexe
  -->
<tns:translationPlugin language="romana" charset="utf-8"
  xmlns:tns="http://phpsysinfo.sourceforge.net/translation-plugin" xmlns:xsi="http://www.w3.org/2001/XMLSchema-instance"
  xsi:schemaLocation="http://phpsysinfo.sourceforge.net/translation-plugin ../../../language/translation-plugin.xsd">
  <expression id="plugin_dmraid_001" name="dmraid_title">
    <exp>Stare RAID</exp>
  </expression>
  <expression id="plugin_dmraid_002" name="dmraid_devices">
    <exp>Dispozitive RAID</exp>
  </expression>
  <expression id="plugin_dmraid_003" name="dmraid_infos">
    <exp>Informații Aditionale </exp>
  </expression>
  <expression id="plugin_dmraid_004" name="dmraid_name">
    <exp>Nume</exp>
  </expression>
  <expression id="plugin_dmraid_005" name="dmraid_status">
    <exp>Stare</exp>
  </expression>
  <expression id="plugin_dmraid_006" name="dmraid_type">
    <exp>Tip RAID</exp>
  </expression>
  <expression id="plugin_dmraid_007" name="dmraid_size">
    <exp>Dimensiune</exp>
  </expression>
  <expression id="plugin_dmraid_008" name="dmraid_stride">
    <exp>Pas</exp>
  </expression>
  <expression id="plugin_dmraid_009" name="dmraid_subsets">
    <exp>Subseturi</exp>
  </expression>
  <expression id="plugin_dmraid_010" name="dmraid_devs">
    <exp>Dispozitive</exp>
  </expression>
  <expression id="plugin_dmraid_011" name="dmraid_spares">
    <exp>Piese</exp>
  </expression>
</tns:translationPlugin>
