<?xml version="1.0" encoding="utf-8"?>
  <!-- $Id: ro.xml 661 2014-05-02 11:26:39Z namiltd $ -->
  <!--
    phpSysInfo language file Language: Romană Created by: Iulian Alexe
  -->
<tns:translationPlugin language="romana" charset="utf-8"
  xmlns:tns="http://phpsysinfo.sourceforge.net/translation-plugin" xmlns:xsi="http://www.w3.org/2001/XMLSchema-instance"
  xsi:schemaLocation="http://phpsysinfo.sourceforge.net/translation-plugin ../../../language/translation-plugin.xsd">
  <expression id="plugin_mdstatus_001" name="mdstatus_title">
    <exp>Stare RAID</exp>
  </expression>
  <expression id="plugin_mdstatus_002" name="mdstatus_support">
    <exp>Tipuri de RAID suportate</exp>
  </expression>
  <expression id="plugin_mdstatus_003" name="mdstatus_devices">
    <exp>Dispozitive RAID</exp>
  </expression>
  <expression id="plugin_mdstatus_004" name="mdstatus_infos">
    <exp>Informații Aditionale</exp>
  </expression>
  <expression id="plugin_mdstatus_005" name="mdstatus_status">
    <exp>Stare</exp>
  </expression>
  <expression id="plugin_mdstatus_006" name="mdstatus_level">
    <exp>Nivele RAID</exp>
  </expression>
  <expression id="plugin_mdstatus_007" name="mdstatus_chunk">
    <exp>Chunk Size</exp>
  </expression>
  <expression id="plugin_mdstatus_008" name="mdstatus_algo">
    <exp>Algoritm</exp>
  </expression>
  <expression id="plugin_mdstatus_009" name="mdstatus_superb">
    <exp>Superblock persistente</exp>
  </expression>
  <expression id="plugin_mdstatus_010" name="mdstatus_avail">
    <exp>disponibil</exp>
  </expression>
  <expression id="plugin_mdstatus_011" name="mdstatus_navail">
    <exp>indisponibil</exp>
  </expression>
  <expression id="plugin_mdstatus_012" name="mdstatus_regact">
    <exp>Înregistrate/Discuri Active</exp>
  </expression>
  <expression id="plugin_mdstatus_013" name="mdstatus_curact">
    <exp>Acțiune curentă</exp>
  </expression>
  <expression id="plugin_mdstatus_014" name="mdstatus_finishin">
    <exp>finisare în</exp>
  </expression>
  <expression id="plugin_mdstatus_015" name="mdstatus_unused">
    <exp>Discuri defolosite</exp>
  </expression>
  <expression id="plugin_mdstatus_016" name="mdstatus_refresh">
    <exp>Ultimul refresh</exp>
  </expression>
</tns:translationPlugin>
