<?xml version="1.0" encoding="utf-8"?>
  <!-- $Id: pl.xml 661 2014-01-08 11:26:39Z aolah76 $ -->
  <!--
    phpSysInfo language file Language: Polish Created by: Created by: Mieczyslaw Nalewaj
  -->
<tns:translationPlugin language="polish" charset="utf-8"
  xmlns:tns="http://phpsysinfo.sourceforge.net/translation-plugin" xmlns:xsi="http://www.w3.org/2001/XMLSchema-instance"
  xsi:schemaLocation="http://phpsysinfo.sourceforge.net/translation-plugin ../../../language/translation-plugin.xsd">
  <expression id="plugin_uprecords_001" name="uprecords_title">
    <exp>Uprecords</exp>
  </expression>
  <expression id="plugin_uprecords_101" name="uprecords_hash">
    <exp>#</exp>
  </expression>
  <expression id="plugin_uprecords_102" name="uprecords_uptime">
    <exp>Czas pracy</exp>
  </expression>
  <expression id="plugin_uprecords_103" name="uprecords_system">
    <exp>System</exp>
  </expression>
  <expression id="plugin_uprecords_104" name="uprecords_bootup">
    <exp>Wystartowa≈Ç</exp>
  </expression>
</tns:translationPlugin>
