<?xml version="1.0" encoding="utf-8"?>
  <!-- $Id: gr.xml 661 2012-08-27 11:26:39Z namiltd $ -->
  <!--
    phpSysInfo language file Language: Greek Created by: mojiro
  -->
<tns:translationPlugin language="greek" charset="utf-8"
  xmlns:tns="http://phpsysinfo.sourceforge.net/translation-plugin" xmlns:xsi="http://www.w3.org/2001/XMLSchema-instance"
  xsi:schemaLocation="http://phpsysinfo.sourceforge.net/translation-plugin ../../../language/translation-plugin.xsd">
  <expression id="plugin_ps_001" name="ps_title">
    <exp>Διεργασίες Συστήματος</exp>
  </expression>
  <expression id="plugin_ps_002" name="ps_command">
    <exp>Εντολή</exp>
  </expression>
  <expression id="plugin_ps_003" name="ps_pid">
    <exp>ID Διεργασίας</exp>
  </expression>
  <expression id="plugin_ps_004" name="ps_ppid">
    <exp>ID Κύριας Διεργασίας</exp>
  </expression>
  <expression id="plugin_ps_005" name="ps_mem">
    <exp>Χρήση Μνήμης</exp>
  </expression>
  <expression id="plugin_ps_006" name="ps_cpu">
    <exp>Χρήση Επεξεργαστή</exp>
  </expression>
</tns:translationPlugin>
