<?xml version="1.0" encoding="utf-8"?>
  <!-- $Id: fr.xml 661 2012-08-27 11:26:39Z namiltd $ -->
  <!--
    phpSysInfo language file Language: French Created by: Erkan VALENTIN
  -->
<tns:translationPlugin language="french" charset="utf-8"
  xmlns:tns="http://phpsysinfo.sourceforge.net/translation-plugin" xmlns:xsi="http://www.w3.org/2001/XMLSchema-instance"
  xsi:schemaLocation="http://phpsysinfo.sourceforge.net/translation-plugin ../../../language/translation-plugin.xsd">
  <expression id="plugin_ps_001" name="ps_title">
    <exp>Etat des processus</exp>
  </expression>
  <expression id="plugin_ps_002" name="ps_command">
    <exp>Commande</exp>
  </expression>
  <expression id="plugin_ps_003" name="ps_pid">
    <exp>ID processus</exp>
  </expression>
  <expression id="plugin_ps_004" name="ps_ppid">
    <exp>ID processus père</exp>
  </expression>
  <expression id="plugin_ps_005" name="ps_mem">
    <exp>Utilisation mémoire</exp>
  </expression>
  <expression id="plugin_ps_006" name="ps_cpu">
    <exp>CPU Usage</exp>
  </expression>
</tns:translationPlugin>
