<?xml version="1.0" encoding="utf-8"?>
  <!-- $Id: de.xml 661 2012-08-27 11:26:39Z namiltd $ -->
  <!--
    phpSysInfo language file Language: German Created by: Matthias Freund (MAFLO321)
  -->
<tns:translationPlugin language="german" charset="utf-8"
  xmlns:tns="http://phpsysinfo.sourceforge.net/translation-plugin" xmlns:xsi="http://www.w3.org/2001/XMLSchema-instance"
  xsi:schemaLocation="http://phpsysinfo.sourceforge.net/translation-plugin ../../../language/translation-plugin.xsd">
  <expression id="plugin_snmppinfo_001" name="snmppinfo_title">
    <exp>Drucker Information</exp>
  </expression>
  <expression id="plugin_snmppinfo_002" name="snmppinfo_date">
    <exp>Letzte Aktualisierung</exp>
  </expression>
  <expression id="plugin_snmppinfo_003" name="snmppinfo_printer">
    <exp>Drucker</exp>
  </expression>
  <expression id="plugin_snmppinfo_004" name="snmppinfo_percent">
    <exp>Prozent</exp>
  </expression>
  <expression id="plugin_snmppinfo_005" name="snmppinfo_units">
    <exp>Units</exp>
  </expression>
  <expression id="plugin_snmppinfo_006" name="snmppinfo_enough">
    <exp>genug</exp>
  </expression>
  <expression id="plugin_snmppinfo_007" name="snmppinfo_unknown">
    <exp>unbekannt</exp>
  </expression>
</tns:translationPlugin>
