<?xml version="1.0" encoding="utf-8"?>
  <!-- $Id: ru.xml 661 2015-01-05 11:26:39Z $ -->
  <!--
    phpSysInfo language file Language: Russian Created by: Denis Sevostyanov (den007)
  -->
<tns:translationPlugin language="english" charset="utf-8"
  xmlns:tns="http://phpsysinfo.sourceforge.net/translation-plugin" xmlns:xsi="http://www.w3.org/2001/XMLSchema-instance"
  xsi:schemaLocation="http://phpsysinfo.sourceforge.net/translation-plugin ../../../language/translation-plugin.xsd">
  <expression id="plugin_uprecords_001" name="uprecords_title">
    <exp>Состояное системы</exp>
  </expression>
  <expression id="plugin_uprecords_002" name="uprecords_date">
    <exp>Последние обновление</exp>
  </expression>
  <expression id="plugin_uprecords_101" name="uprecords_hash">
    <exp>#</exp>
  </expression>
  <expression id="plugin_uprecords_102" name="uprecords_uptime">
    <exp>Аптайм</exp>
  </expression>
  <expression id="plugin_uprecords_103" name="uprecords_system">
    <exp>Система</exp>
  </expression>
  <expression id="plugin_uprecords_104" name="uprecords_bootup">
    <exp>Загружено</exp>
  </expression>
</tns:translationPlugin>
