<?xml version="1.0" encoding="utf-8"?>
  <!-- $Id: ro.xml 661 2014-05-02 11:26:39Z namiltd $ -->
  <!--
    phpSysInfo language file Language: Romană Created by: Iulian Alexe
  -->
<tns:translationPlugin language="romana" charset="utf-8"
  xmlns:tns="http://phpsysinfo.sourceforge.net/translation-plugin" xmlns:xsi="http://www.w3.org/2001/XMLSchema-instance"
  xsi:schemaLocation="http://phpsysinfo.sourceforge.net/translation-plugin ../../../language/translation-plugin.xsd">
  <expression id="plugin_bat_001" name="bat_title">
    <exp>Stare Baterie</exp>
  </expression>
  <expression id="plugin_bat_002" name="bat_date">
    <exp>Ultimul refresh</exp>
  </expression>
  <expression id="plugin_bat_003" name="bat_design_capacity">
    <exp>Capacitate Design</exp>
  </expression>
  <expression id="plugin_bat_004" name="bat_remaining_capacity">
    <exp>Capacitate rămasă</exp>
  </expression>
  <expression id="plugin_bat_005" name="bat_design_voltage">
    <exp>Voltaj design</exp>
  </expression>
  <expression id="plugin_bat_006" name="bat_present_voltage">
    <exp>Voltaj prezent</exp>
  </expression>
  <expression id="plugin_bat_007" name="bat_item">
    <exp>Elemente</exp>
  </expression>
  <expression id="plugin_bat_008" name="bat_value">
    <exp>Valori</exp>
  </expression>
  <expression id="plugin_bat_009" name="bat_charging_state">
    <exp>Stare de Încărcare</exp>
  </expression>
  <expression id="plugin_bat_010" name="bat_battery_type">
    <exp>Tip Baterie</exp>
  </expression>
  <expression id="plugin_bat_011" name="bat_battery_temperature">
    <exp>Temperatura Baterie</exp>
  </expression>
  <expression id="plugin_bat_012" name="bat_battery_condition">
    <exp>Condiții Baterie</exp>
  </expression>
  <expression id="plugin_bat_013" name="bat_cycle_count">
    <exp>Cycle Count</exp>
  </expression>
</tns:translationPlugin>
