<?xml version="1.0" encoding="utf-8"?>
  <!-- $Id: de.xml 661 2012-08-27 11:26:39Z namiltd $ -->
  <!--
    phpSysInfo language file Language: German Created by: Michael Cramer
  -->
<tns:translationPlugin language="german" charset="utf-8"
  xmlns:tns="http://phpsysinfo.sourceforge.net/translation-plugin" xmlns:xsi="http://www.w3.org/2001/XMLSchema-instance"
  xsi:schemaLocation="http://phpsysinfo.sourceforge.net/translation-plugin ../../../language/translation-plugin.xsd">
  <expression id="plugin_raid_001" name="raid_title">
    <exp>RAID Status</exp>
  </expression>
  <expression id="plugin_raid_002" name="raid_infos">
    <exp>Zusätzliche Informationen</exp>
  </expression>
  <expression id="plugin_raid_003" name="raid_name">
    <exp>Name</exp>
  </expression>
  <expression id="plugin_raid_004" name="raid_status">
    <exp>Status</exp>
  </expression>
  <expression id="plugin_raid_005" name="raid_level">
    <exp>RAID-Level</exp>
  </expression>
  <expression id="plugin_raid_006" name="raid_size">
    <exp>Size</exp>
  </expression>
  <expression id="plugin_raid_007" name="raid_stride">
    <exp>Stride</exp>
  </expression>
  <expression id="plugin_raid_008" name="raid_subsets">
    <exp>Subsets</exp>
  </expression>
  <expression id="plugin_raid_009" name="raid_devs">
    <exp>Devices</exp>
  </expression>
  <expression id="plugin_raid_010" name="raid_spares">
    <exp>Spares</exp>
  </expression>
  <expression id="plugin_raid_011" name="raid_curact">
    <exp>Current Action</exp>
  </expression>
  <expression id="plugin_raid_012" name="raid_finish">
    <exp>Fertig in</exp>
  </expression>
  <expression id="plugin_raid_013" name="raid_chunk">
    <exp>Blockgröße</exp>
  </expression>
  <expression id="plugin_raid_014" name="raid_algo">
    <exp>Algorithmus</exp>
  </expression>
  <expression id="plugin_raid_015" name="raid_superb">
    <exp>Persistenter Superblock</exp>
  </expression>
  <expression id="plugin_raid_016" name="raid_avail">
    <exp>verfügbar</exp>
  </expression>
  <expression id="plugin_raid_017" name="raids_navail">
    <exp>nicht verfügbar</exp>
  </expression>
  <expression id="plugin_raid_018" name="raid_regact">
    <exp>Registrierte/Aktive Platten</exp>
  </expression>
  <expression id="plugin_raid_019" name="raid_controller">
    <exp>Controller</exp>
  </expression>
  <expression id="plugin_raid_020" name="raid_battcond">
    <exp>Akku-Zustand</exp>
  </expression>
  <expression id="plugin_raid_021" name="raid_supported">
    <exp>Unterstützte RAID-Typen</exp>
  </expression>
  <expression id="plugin_raid_022" name="raid_program">
    <exp>Program</exp>
  </expression>
  <expression id="plugin_raid_023" name="raid_readpolicy">
    <exp>Read Policy</exp>
  </expression>
  <expression id="plugin_raid_024" name="raid_writepolicy">
    <exp>Write Policy</exp>
  </expression>
  <expression id="plugin_raid_025" name="raid_cachesize">
    <exp>Cache Size</exp>
  </expression>
  <expression id="plugin_raid_026" name="raid_badblocks">
    <exp>Bad Blocks</exp>
  </expression>
  <expression id="plugin_raid_027" name="raid_diskcache">
    <exp>Disk Cache</exp>
  </expression>
  <expression id="plugin_raid_028" name="raid_stripe">
    <exp>Stripe Size</exp>
  </expression>
</tns:translationPlugin>
