<?xml version="1.0" encoding="utf-8"?>
  <!-- $Id: en.xml 661 2012-08-27 11:26:39Z namiltd $ -->
  <!--
    phpSysInfo language file Language: English Created by: Mieczyslaw Nalewaj
  -->
<tns:translationPlugin language="english" charset="utf-8"
  xmlns:tns="http://phpsysinfo.sourceforge.net/translation-plugin" xmlns:xsi="http://www.w3.org/2001/XMLSchema-instance"
  xsi:schemaLocation="http://phpsysinfo.sourceforge.net/translation-plugin ../../../language/translation-plugin.xsd">
  <expression id="plugin_ipmiinfo_001" name="ipmiinfo_title">
    <exp>IPMI Status</exp>
  </expression>
  <expression id="plugin_ipmiinfo_002" name="ipmiinfo_date">
    <exp>Last refresh</exp>
  </expression>
  <expression id="plugin_ipmiinfo_003" name="ipmiinfo_temperatures">
    <exp>Temperatures [Â°C]</exp>
  </expression>
  <expression id="plugin_ipmiinfo_004" name="ipmiinfo_fans">
    <exp>Fans [RPM]</exp>
  </expression>
  <expression id="plugin_ipmiinfo_005" name="ipmiinfo_voltages">
    <exp>Voltages [V]</exp>
  </expression>
  <expression id="plugin_ipmiinfo_006" name="ipmiinfo_misc">
    <exp>Misc [0/1]</exp>
  </expression>
  <expression id="plugin_ipmiinfo_007" name="ipmiinfo_currents">
    <exp>Currents [A]</exp>
  </expression>
  <expression id="plugin_ipmiinfo_008" name="ipmiinfo_powers">
    <exp>Powers [W]</exp>
  </expression>
</tns:translationPlugin>
